证券代码,证券名称,流通市值,总市值,最新价,涨跌幅,所属同花顺行业,三级行业,二级行业,一级行业,主营产品,投资逻辑,公司亮点,所属概念,沪深指数
301060.SZ,兰卫医学,31.6,70.7,17.66,0.8,医药生物-医疗服务-其他医疗服务,医疗诊断,医疗服务,生物医药,医学诊断服务,上海、武汉、东莞等地卫健委指定的第三方新冠检验机构,国内检验诊断领域占有一定地位、拥有丰富的独立医学实验室运营经验的专业医疗服务机构,"辅助生殖,新冠检测,基因测序,幽门螺杆菌,专精特新,猴痘,人工智能,体外诊断","创业300,中证1000"
600795.SH,国电电力,676.0,676.0,3.79,0.8,公用事业-电力-火电,火电,电力,公共事业,火电（华东）,国家能源集团控股上市公司,高效火电和清洁能源项目开发,"MSCI,分布式发电,东北亚经贸中心,电力改革,国企改革,绿色电力,新能源,证金持股,振兴东北,央企国企改革,风电,地方国企改革",沪深300
600712.SH,南宁百货,20.4,20.6,3.79,0.8,商贸零售-零售-百货零售,百货,零售,可选消费,广西百货,广西规模最大的商业零售企业之一，中华老字号商店,国家商务部评选的“中华老字号商店,"农村电商,新零售,商超百货,免税店,东盟自贸区,职业教育,国企改革,生物医药,跨境电商,网络直播,乡村振兴,地方国企改革",
603839.SH,安正时尚,30.3,30.3,7.59,0.8,纺织服装-服装家纺-服装,服装,纺织,可选消费,品牌女装,主导品牌“玖姿”为我国成熟女装的领导品牌之一,中高档品牌时装的自主研发、生产、销售及品牌管理,"长三角一体化,大消费,电子商务,三胎",
688047.SH,龙芯中科,317.4,457.1,113.99,0.8,电子-半导体及元件-集成电路设计,逻辑,半导体,科技,处理器,国产CPU龙头之一,中国自研CPU第一股,"MCU芯片,国家大基金持股,信创,芯片,汽车芯片",科创50
605199.SH,葫芦娃,61.0,61.0,15.24,0.79,医药生物-中药-中药Ⅲ,中药,中药,生物医药,呼吸系统药物,国内儿科呼吸系统治疗领域的领军企业,国内儿科呼吸系统治疗领域的领军企业,"医保目录,肝炎,中医药,儿童医药医疗,新冠治疗,幽门螺杆菌,仿制药一致性评价,流感,海南自贸区,专精特新,三胎",中证1000
300941.SZ,创识科技,17.3,41.6,20.34,0.79,计算机-计算机设备-计算机设备Ⅲ,金融科技,计算机,科技,银行支付IT,国内重要的电子支付IT方案商,电子支付IT方案商，客户主要为农业银行,"鸿蒙,雄安新区,智慧政务,移动支付,冬奥会,电子发票,数字货币,福建自贸区",
001896.SZ,豫能控股,67.2,77.7,5.09,0.79,公用事业-电力-火电,火电,电力,公共事业,火电（华中）,集火电、新能源、煤炭贸易物流等于一体的综合能源公司,火电装机容量位居河南省第二位,"煤炭,储能,煤价下跌受益,光伏建筑一体化,电力改革,供应链金融,国企改革,绿色电力,地热能,华为,抽水蓄能,新能源,充电桩,河南国企改革,氢能源,光伏,碳中和,风电,超超临界发电,地方国企改革",
300564.SZ,筑博设计,13.9,20.9,12.74,0.79,建筑装饰-建筑装饰-工程咨询服务,工程设计,工程设计,建筑业,建筑设计,长期位列国内民营建筑设计企业第一梯队,主要从事建筑设计及其相关业务的设计与咨询,"装配式建筑,新型城镇化,海绵城市,光伏建筑一体化,粤港澳大湾区",
603357.SH,设计总院,55.6,57.2,10.2,0.79,建筑装饰-建筑装饰-工程咨询服务,工程设计,工程设计,建筑业,勘察设计,安徽工程设计与咨询行业龙头,安徽省国资委旗下，安徽省属企业首家、全国公路设计行业第6家获得工程设计综合甲级资质单位,"养老金持股,云计算,智能交通,安徽国企改革,国企改革,一带一路,量子科技,水利,智慧城市,新型城镇化,地方国企改革,雄安新区",
600697.SH,欧亚集团,19.8,20.3,12.75,0.79,商贸零售-零售-百货零售,百货,零售,可选消费,吉林百货,吉林省的商业龙头企业，中国商业零售业第一方阵企业,吉林省的商业龙头企业之一，长春地区效益最好的百货门店之一,"中俄贸易,中朝贸易区,吉林国企改革,养老金持股,预制菜,新零售,商超百货,免税店,电子商务,国企改革,大消费,振兴东北,跨境电商,室外经济,地方国企改革",
601869.SH,长飞光纤,145.4,271.2,35.78,0.79,通信-通信设备-通信线缆及配套,光缆,通信,科技,光纤、光缆,全球最大的光纤预制棒、光纤和光缆供应商,全球光纤光缆行业的领先企业，已深耕光通信领域多年,"光纤光缆,太赫兹,工业互联网,芯片,超清视频,智能电网,第三代半导体,特高压,共封装光学（CPO）,集成电路,5G",中证500
601010.SH,文峰股份,47.3,47.3,2.56,0.79,商贸零售-零售-百货零售,百货,零售,可选消费,南通百货,南通市最大的零售企业，江苏省领先的零售企业之一,江苏省领先的零售企业之一，南通市最大的零售企业,"徐翔,证金持股",
301151.SZ,冠龙节能,9.8,30.1,17.93,0.79,机械设备-通用设备-金属制品,阀门,金属制品,机械,节水阀门,国内给排水阀门领域市占率排名第一,国内给排水阀门领域市占率排名第一,"地下管网,水利,新型城镇化,乡村振兴,节能环保,超超临界发电,抽水蓄能,雄安新区",
603365.SH,水星家纺,37.6,37.6,14.09,0.79,纺织服装-服装家纺-家纺,家纺,纺织,可选消费,家用纺织品,公司位列国内床上用品市场第一集团,全国家纺行业质量领军企业，产品包括套件、被芯等床用纺织品,电子商务,
688065.SH,凯赛生物,168.9,373.7,64.07,0.79,基础化工-化学制品-其他化学制品,化学制品,基础化工,化工,生物法长链二元酸,全球领先的利用生物制造规模化生产新型材料的企业之一,长链二元酸全球最大供应商,"专精特新,新材料,可降解塑料","科创50,沪深300"
603182.SH,嘉华股份,6.3,25.3,15.38,0.79,农林牧渔-农产品加工-粮油加工,粮食加工,农业,必需消费,大豆蛋白,嘉华品牌(Sinoglory)为国际大豆蛋白市场的知名品牌,国内知名的大豆深加工企业,"大豆,粮食,人造肉",
603002.SH,宏昌电子,31.5,46.4,5.13,0.79,电子-电子化学品-电子化学品Ⅲ,电子材料,消费电子,科技,PCB和环氧树脂,领先的电子级环氧树脂及PCB专业厂商之一,国内电子级环氧树脂领域龙头公司,"覆铜板,台湾,5G,3D打印,环氧树脂",
601226.SH,华电重工,89.2,90.1,7.72,0.78,建筑装饰-建筑装饰-专业工程,钢结构,基建,建筑业,建筑安装,全球最大的冶金工程建设综合企业集团之一,主营物料输送系统、热能、高端钢结构工程，技术实力行业领先,"核电,质子交换膜,国产替代,国企改革,燃料电池,机器人,高端装备,氢能源,一带一路,央企国企改革,海上风电,风电,超超临界发电,地方国企改革",
301106.SZ,骏成科技,7.8,27.1,37.33,0.78,电子-光学光电子-面板,显示面板,消费电子,科技,定制化液晶专显产品,公司在液晶专显领域拥有较为完善的产品结构,专业生产销售STN型液晶显示器和显示模组,汽车电子,
688256.SH,寒武纪-U,480.9,820.5,196.96,0.78,电子-半导体及元件-集成电路设计,逻辑,半导体,科技,人工智能芯片,国内人工智能芯片龙头企业之一,科创板AI芯片第一股，全球智能芯片领域的先行者，全球少数全面掌握通用性智能芯片及基础系统软件核心技术的企业,"阿里巴巴,MSCI,先进封装（Chiplet）,东数西算（算力）,国产操作系统,芯片,人工智能,边缘计算","中证500,科创50"
605033.SH,美邦股份,6.5,26.6,19.31,0.78,基础化工-化学制品-农药,农药,基础化工,化工,农药制剂,深耕于农药制剂行业，已建立起行业领先的技术优势,深耕于农药制剂行业，已建立起行业领先的技术优势,,上证150
603176.SH,汇通集团,9.7,30.1,6.45,0.78,建筑装饰-建筑装饰-基础建设,路桥建设,基建,建筑业,公路市政工程施工,公路工程施工总承包特级资质企业之一,公司是公路工程施工总承包特级资质企业之一,"PPP,水利,新型城镇化,雄安新区,乡村振兴,基建工程,京津冀一体化",
301055.SZ,张小泉,8.3,22.1,14.19,0.78,轻工制造-家用轻工-其他家用轻工,日用品,家居装修,建筑业,剪刀、刀具,我国刀剪行业百年品牌，第一批中华老字号,我国刀剪行业百年品牌，被商务部认定为第一批中华老字号,"NFT,家用电器,电子商务",
300045.SZ,华力创通,57.2,76.9,11.61,0.78,国防军工-国防军工-军工电子,军工电子,军工,公共事业,仿真培训系统,国内计算机仿真行业领先企业,国内计算机仿真行业领先企业,"军工,6G,大飞机,农机,军民融合,独角兽,毫米波雷达,芯片,成飞,车联网,时空大数据,增强现实,遥感技术,无人驾驶,雷达,态势感知,虚拟现实,轨道交通,无人机,卫星导航,网络安全,数字孪生,人工智能",
000568.SZ,泸州老窖,3119.4,3135.3,213.0,0.78,食品饮料-饮料制造-白酒,白酒,饮料,必需消费,浓香型白酒,具有400多年酿酒历史的白酒龙头之一,白酒行业知名企业，国窖1573是国内唯一的浓香型有机白酒,"白酒,MSCI,国企改革,大消费,同花顺漂亮100,超级品牌,证金持股,成渝特区,地方国企改革",沪深300
300098.SZ,高新兴,59.0,67.4,3.88,0.78,计算机-计算机应用-软件开发,人工智能,计算机,科技,视频监控终端,智慧城市物联网产品与服务提供商,掌握物联网和视频人工智能核心技术,"物联网,工业机器人,电子车牌,安防,工业互联网,数据中心,腾讯,车联网,物联网感知层,元宇宙,华为,机器人,汽车电子,PPP,增强现实,无人驾驶,虚拟现实,比亚迪,百度,智慧城市,卫星导航,人脸识别,5G,人工智能",
002265.SZ,西仪股份,45.4,147.2,14.25,0.78,国防军工-国防军工-地面兵装,陆军装备,军工,公共事业,汽车连杆类,汽车连杆行业龙头企业,兵装集团旗下，国内最大的汽车发动机连杆专业生产企业,"新能源汽车,央企国企改革,比亚迪,地方国企改革,中兵系,国企改革",
301089.SZ,拓新药业,55.0,89.8,71.29,0.78,医药生物-化学制药-原料药,原料药,生物,生物医药,核苷医药中间体,国内少数几家能够规模化生产胞磷胆碱钠的企业之一,国内最早工业化生产胞苷的企业，多年来胞苷合成工艺一直处于市场的领先地位,"肝炎,新冠治疗,新冠特效药,猴痘","创业300,中证1000"
300888.SZ,稳健医疗,77.9,246.6,41.49,0.78,纺织服装-纺织制造-其他纺织,医疗耗材,医疗器械,生物医药,医用敷料,医用敷料行业全国第二,国内最早建立医用纱布全产业链，并实现纱布成品直接对外出口的企业之一,"养老金持股,抗原检测,新冠检测,电子商务,医疗器械,口罩,跨境电商,网络直播,三胎","创业300,中证500"
603777.SH,来伊份,48.1,48.1,14.3,0.78,食品饮料-食品加工制造-休闲食品,零食,食品,必需消费,休闲食品,国内销售规模.门店数量领先的休闲食品连锁企业之一,国内销售规模、拥有门店数量领先的休闲食品连锁经营企业之一,"白酒,休闲零食,新零售,社区团购,电子商务,盲盒,大消费,智能物流,腾讯,人工智能",
601881.SH,中国银河,778.8,1210.6,11.7,0.78,非银金融-证券-证券Ⅲ,证券,非银金融,金融,证券业务,国内分支机构最多的证券公司,国内分支机构最多的证券公司,"互联网券商,MSCI,北京自贸区,国企改革,央企国企改革,同花顺中特估100,北交所",沪深300
600724.SH,宁波富达,56.4,56.4,3.9,0.78,房地产-房地产开发-商业地产,水泥,建筑材料,建筑业,商业地产，水泥销售,布局水泥、商业地产运营、燃料油加工的国有控股企业,地方城投背景的区域性商业地产运营，具有一定的区域资源优势,"物业管理,浙江国企改革,水泥,地方国企改革,舟山自贸区,国企改革",
300395.SZ,菲利华,217.2,234.9,45.52,0.77,国防军工-国防军工-航空装备,飞机,军工,公共事业,石英玻璃,通过国际三大半导体原产设备商认证的石英材料企业,国内唯一一家通过国际三大半导体原产设备商认证的石英材料企业,"OLED材料,光纤光缆,国产替代,蓝宝石,军民融合,集成电路,5G,OLED","创业300,中证500"
603681.SH,永冠新材,27.4,27.4,14.33,0.77,基础化工-化学制品-其他化学制品,粘胶,基础化工,化工,各类胶带产品,国内胶带行业龙头企业之一,各类胶带的研发、生产和销售，拥有国际知名品牌客户,"可降解塑料,长三角一体化,国产替代,医疗器械,人民币贬值受益",
600251.SH,冠农股份,71.0,71.0,9.14,0.77,农林牧渔-农产品加工-果蔬加工,粮食加工,农业,必需消费,番茄,公司番茄、棉花种植销售处于全国行业优势地位,番茄、棉花具有一定的行业优势地位,"棉,环境监测,农村电商,新疆振兴,国家科技大会,化肥,国企改革,盐湖提锂,西部开发,食品安全,白糖,乡村振兴,新疆建设兵团,数字乡村,中俄贸易,番茄酱,饲料,钾肥,棉花种植,硫酸钾,新疆旅游,地方国企改革",
300129.SZ,泰胜风能,57.2,85.4,9.14,0.77,电力设备-电力设备-风电设备,风机塔架,风电,电力设备,其他海上风电装备,全国风机塔架行业领先水平,国内风电塔架行业居于领先地位,"军工,新能源,广东国企改革,国企改革,专精特新,海上风电,风电,地方国企改革",
300827.SZ,上能电气,104.7,144.1,40.48,0.77,电力设备-电力设备-光伏设备,逆变器,光伏,电力设备,光伏逆变器,光伏逆变器市占率全球前五,中国前三逆变器制造商,"储能,智能电网,专精特新,一带一路,光伏","创业300,中证1000"
688777.SH,中控技术,307.3,451.7,57.47,0.77,机械设备-自动化设备-工控设备,自动化设备,机械设备,机械,工业自动化控制系统,国内流程工业自动化领域的领先企业之一,中国工业自动化行业龙头企业,"信创,工业互联网,智能制造,工业4.0","中证500,科创50"
600618.SH,氯碱化工,68.6,105.8,9.15,0.77,基础化工-化学原料-氯碱,氯碱,化学原料,化工,氯碱,综合实力列全国氯碱行业之首,综合实力列全国氯碱行业之首,"氟化工,上海国企改革,地方国企改革,消毒剂,国企改革,4D打印,液氯,MDI,烧碱,PVC",中证1000
300953.SZ,震裕科技,34.1,76.8,74.73,0.77,电力设备-电力设备-电池,锂电设备,储能,电力设备,锂电池精密结构件,全球领先的精密模具综合解决方案供应商,全球领先的精密模具综合解决方案供应商,"储能,国产替代,比亚迪,宁德时代,新能源汽车,节能环保,锂电池","创业300,中证1000"
688184.SH,帕瓦股份,9.0,42.3,31.49,0.77,电力设备-电力设备-电池,正极材料,储能,电力设备,锂离子电池三元正极材料前驱体,专注于NCM三元前驱体，市场份额为2.00%，列第九名,专注于NCM三元前驱体，营收主要来自于杉杉能源和厦钨新能等大客户,"宁德时代,锂电池",
002714.SZ,牧原股份,1527.2,2295.4,42.0,0.77,农林牧渔-养殖业-畜禽养殖,猪肉,养殖,必需消费,养猪,我国境内最大的自育自繁自养一体化的生猪养殖企业之一,完整的生猪产业链，高自动化水平的猪舍和饲喂系统，竞争优势明显,"MSCI,饲料,猪肉,同花顺漂亮100,乡村振兴",沪深300
300223.SZ,北京君正,372.0,430.9,89.47,0.77,电子-半导体及元件-集成电路设计,存储,半导体,科技,ASIC，MCU,车载存储新龙头,掌握嵌入式CPU核心技术并成功市场化的极少数本土企业之一,"物联网,智能穿戴,MSCI,区块链,智能眼镜,芯片,存储芯片,OLED,智能音箱,汽车芯片,小米,超清视频,MiniLED,汽车电子,芯片设计,智能手表,MCU芯片,集成电路,人工智能","创业板50,沪深300,创业300"
001301.SZ,尚太科技,35.1,140.3,53.99,0.77,电力设备-电力设备-电池,负极材料,储能,电力设备,锂电池负极材料,锂电负极材料国内市占率前五,锂电负极材料国内市占率前五,"新能源,石墨电极,京津冀一体化,负极材料,宁德时代,增碳剂,锂电池",中证1000
600376.SH,首开股份,102.7,102.7,3.98,0.76,房地产-房地产开发-住宅开发,住宅,房地产,金融,北京地产,国资背景，定位于北京市场的房地产开发商,定位于北京市场的房地产开发商,"棚户区改造,MSCI,北京国企改革,国企改革,首都副中心,中央政务区,证金持股,REITs,保障房,地方国企改革,雄安新区",
600674.SH,川投能源,651.7,651.7,14.61,0.76,公用事业-电力-水电,水电,电力,公共事业,水电（四川）,四川水电龙头，旗下新光硅业是多晶硅行业领军企业之一,清洁能源主业优势突出，旗下新光硅业是多晶硅行业领军企业之一,"新能源,MSCI,证金持股,四川国企改革,电力改革,国企改革,绿色电力,成渝特区,地方国企改革",沪深300
301017.SZ,漱玉平民,20.4,75.6,18.64,0.76,医药生物-医药商业-医药商业Ⅲ,医药商业,医疗服务,生物医药,医药零售,山东省内领先的零售药店,国内知名连锁药店,"阿里巴巴,中医药,家庭医生,冷链物流,养老,医美,医药电商",创业300
600838.SH,上海九百,26.8,26.8,6.68,0.75,商贸零售-零售-百货零售,百货,零售,可选消费,商业零售,控股“久光”百货，参与洗涤化工产品,主营洗涤化工产品、商业地产、百货业,"新零售,商超百货,上海国企改革,国企改革,地方国企改革",
600761.SH,安徽合力,158.3,158.3,21.38,0.75,机械设备-专用设备-工程机械,工程机械,工程机械,建筑业,叉车,中国工业车辆行业的龙头企业,叉车产品处于国内领先、国际先进水平,"高端装备,地方国企改革,安徽国企改革,国企改革",中证1000
300185.SZ,通裕重工,99.3,104.4,2.68,0.75,电力设备-电力设备-风电设备,风电铸件,风电,电力设备,铸件,国内最大MW级风电主轴之一,我国最大的球墨铸铁管管模及MW级风力发电机主轴生产企业,"军工,核污染防治,新材料,核电,京津冀一体化,国企改革,珠海国企改革,广东国企改革,高端装备,光伏,海上风电,风电,超超临界发电,地方国企改革","创业300,中证1000"
603986.SH,兆易创新,704.0,707.0,106.0,0.75,电子-半导体及元件-集成电路设计,存储,半导体,科技,NOR Flash,国内存储芯片龙头，NOR Flash国内市占率第一,主要产品为闪存芯片，半导体存储器领域领导企业,"物联网,MSCI,国家大基金持股,央视财经50,芯片,存储芯片,超清视频,汽车芯片,内存,汽车电子,芯片设计,AI芯片,MCU芯片,人民币贬值受益,芯片制造,集成电路,无线耳机,人工智能","上证50,沪深300"
300190.SZ,维尔利,31.3,31.5,4.03,0.75,环保-环保-综合环境治理,综合环保,环保,公共事业,垃圾渗滤液处理,主要从事垃圾渗滤液处理业务,垃圾渗滤液业拥有MBR、厌氧、超滤、纳滤、反渗透等核心技术,"PPP,固废处理,碳交易,美丽中国,土壤修复,专精特新,污水处理,垃圾分类,碳中和,节能环保,危废处理",
601368.SH,绿城水务,47.5,47.5,5.38,0.75,环保-环保-水务及水治理,水务,环保,公共事业,水供给,取得南宁市特许经营权的国有控股水务公司,国内自动化程度最高，少数拥有废水处理系统的水厂之一,"污水处理,新型城镇化,地方国企改革,国企改革",
300719.SZ,安达维尔,24.4,34.4,13.46,0.75,国防军工-国防军工-航空装备,飞机,军工,公共事业,航空机载设备维修,公司为国内军用直升机抗坠毁座椅核心供应商,有潜力成为国内航空工业领域重要的一级供应商,"军工,碳纤维,高端装备,航空航天,大飞机,虚拟现实,军民融合,成飞,通用航空,信创",
301122.SZ,采纳股份,16.7,46.1,37.69,0.75,医药生物-医疗器械-医疗耗材,医疗耗材,医疗器械,生物医药,兽用注射穿刺器械,国内兽用注射器/针行业龙头,专业制造注射针、注射器等其他相关医疗器械的科技型中小企业,"外贸受益,辅助生殖,人民币贬值受益,医疗器械",
600608.SH,ST沪科,12.9,13.3,4.04,0.75,商贸零售-贸易-贸易Ⅲ,贸易,零售,可选消费,塑料粒子贸易,化工贸易行业内拥有强大资源整合与风险管控能力的企业,芯片设计和服务能力保持在国内同行的领先水平,"云南国企改革,地方国企改革,国企改革",
688553.SH,汇宇制药-W,42.9,62.8,14.83,0.75,医药生物-化学制药-化学制剂,制药,生物,生物医药,肿瘤治疗,公司有10款高端注射剂获批生产并视同过评,注射用阿扎胞苷产品视同通过一致性评价的国内两家首仿企业之一,"CRO,创新药,仿制药一致性评价",
603369.SH,今世缘,659.6,659.6,52.58,0.75,食品饮料-饮料制造-白酒,白酒,饮料,必需消费,浓香型白酒,江苏省仅次于洋河股份的白酒企业，定位于中国人的喜酒,拥有“国缘、今世缘、高沟”三个著名白酒品牌,"白酒,MSCI,江苏国企改革,国企改革,地方国企改革",沪深300
000761.SZ,本钢板材,150.2,166.4,4.05,0.75,黑色金属-钢铁-普钢,普钢,钢铁,资源,钢板,板材产品龙头企业，以“人参铁”著称,地处辽宁的大型钢板、钢坯生产企业,"特钢,国企改革,轧板,央企国企改革,地方国企改革",中证1000
603488.SH,展鹏科技,23.7,23.7,8.13,0.74,机械设备-专用设备-楼宇设备,电梯,家居装修,建筑业,电梯门系统,电梯门系统领域的领先企业,国内拥有自主变频控制核心技术并较早应用于电梯门系统的企业,"新能源汽车,半年报预增,换电,电梯",
300128.SZ,锦富技术,59.2,59.3,5.42,0.74,电子-光学光电子-面板,膜材料,合成材料,化工,光电显示薄膜器件,国内光电显示薄膜器件领域领先企业,中国领先的光电显示薄膜器件生产和整体解决方案提供厂商,"智能终端,OLED设备制造,元器件,消费电子,宁德时代,江苏国企改革,智能电视,噪声防治,国企改革,地方国企改革",
002177.SZ,御银股份,31.0,31.0,4.07,0.74,商贸零售-零售-商业物业经营,商城,零售,可选消费,产业园运营,广东省自有物业运营领先企业,广东省ATM设备行业领先企业,"区块链,虹膜识别,ATM机,国产替代,互联网金融,指纹技术,村镇银行,国产操作系统,人脸识别,数字货币,NFC",
833427.BJ,华维设计,2.0,5.6,5.43,0.74,建筑装饰-建筑装饰-工程咨询服务,工程设计,工程设计,建筑业,工程设计及咨询业务,持有国家甲级设计、甲级咨询资质证书,高新工程设计综合服务商,,
002093.SZ,国脉科技,82.0,82.1,8.15,0.74,社会服务-教育-教育Ⅲ,教育,社会服务,可选消费,ICT网络技术服务,国内领先的信息通信技术外包服务提供商,5G、物联网技术综合解决方案服务提供商，具有完整的电信服务产业链，全资举办了福州理工学院,"物联网,数字中国,6G,职业教育,数据确权,电子信息,养老,TMT,智能医疗,高校,物联网平台层,数字经济,医疗器械,海峡两岸,5G,云计算",
600370.SH,三房巷,31.7,106.0,2.72,0.74,基础化工-化学制品-聚氨酯,聚氨酯,基础化工,化工,PET瓶级聚酯切片,国内PET聚酯行业知名企业,国内印染行业十佳企业，具备年产印染布1亿米的生产能力,"可降解塑料,PTA",中证1000
600170.SH,上海建工,241.7,241.7,2.72,0.74,建筑装饰-建筑装饰-房屋建设,建筑工程,基建,建筑业,建筑施工,上海城市建设龙头，具有一系列行业高等级资质,具有一系列行业高等级资质的建筑业龙头企业,"黄金,核电,MSCI,土壤修复,迪士尼,光伏建筑一体化,国企改革,水利,住房租赁,浦东新区,PPP,证金持股,上海国企改革,浦东前滩,一带一路,保障房,碳中和,方舱医院,地方国企改革,装配式建筑,雄安新区",中证500
300116.SZ,保力新,55.8,60.2,1.36,0.74,电力设备-电力设备-电池,锂电池,储能,电力设备,锂离子动力电池,国内最早成功研发磷酸铁锂新能源汽车动力电池之一,公司磷酸铁锂在新能源商用车领域的应用具有很大优势具有竞争优势,"储能,一元股,磷酸铁锂,换电,两轮车,锂电池,锂电制造",
000895.SZ,双汇发展,848.7,848.8,24.5,0.74,食品饮料-食品加工制造-肉制品,猪肉,养殖,必需消费,肉制品,境内最大的肉类加工企业,国内肉制品行业第一品牌,"预制菜,MSCI,人造肉,大消费,猪肉收储,央视财经50,超级品牌,证金持股,猪肉,养鸡",沪深300
600315.SH,上海家化,192.5,194.2,28.6,0.74,美容护理-美容护理-化妆品,化妆品,医美,可选消费,个人护理,中国日化行业的支柱企业,中国日化护理行业的支柱企业,"MSCI,化妆护肤品,电子商务,消毒剂,大消费,三胎",中证500
002623.SZ,亚玛顿,56.8,56.9,28.6,0.74,电力设备-电力设备-光伏设备,玻璃,建筑材料,建筑业,光伏玻璃,全球唯一一家用物理化钢化生产超薄双玻组件的企业,全球唯一一家用物理化钢化技术规模化生产超薄双玻组件的企业,"太阳能,特斯拉,新材料,新能源,光伏建筑一体化,绿色电力,光伏,光伏玻璃,建筑节能,玻璃",
300756.SZ,金马游乐,17.6,27.0,19.09,0.74,机械设备-专用设备-其他专用设备,娱乐,社会服务,可选消费,大型游乐设施,专业从事游乐设施开发、生产和销售的高新技术企业,专业从事游乐设施开发、生产和销售的高新技术企业,"环球主题公园,虚拟现实,元宇宙,旅游,三胎",
