证券代码,证券名称,流通市值,总市值,最新价,涨跌幅,所属同花顺行业,三级行业,二级行业,一级行业,主营产品,投资逻辑,公司亮点,所属概念,沪深指数
300819.SZ,聚杰微纤,18.8,20.8,13.95,0.0,纺织服装-纺织制造-其他纺织,纺织制造,纺织,可选消费,超细纤维制成品,国内超细复合纤维面料龙头,中国超细纤维面料精品生产基地，国家高新科技企业,"人民币贬值受益,口罩",
300745.SZ,欣锐科技,46.6,58.8,46.3,0.0,交运设备-汽车零部件-汽车零部件Ⅲ,汽车电气,汽车零部件,汽车,车载充电机,新能源汽车高压”电控“解决方案供应商,专注于新能源汽车车载电源领域的国家高新技术企业,"碳化硅,比亚迪,小鹏汽车,北汽新能源,新能源汽车,高压快充,燃料电池",
300720.SZ,海川智能,22.2,25.1,12.88,0.0,机械设备-仪器仪表-仪器仪表Ⅲ,仪器仪表,机械设备,机械,自动衡器,掌握了完整的组合秤设计生产相关的技术工艺,主要从事自动衡器领域，建立了较为完整的研发体系,"台湾,东盟自贸区,服务机器人,机器人",
300521.SZ,爱司凯,18.1,18.1,12.55,0.0,机械设备-专用设备-印刷包装机械,印刷设备,包装印刷,可选消费,工业化打印产品,国内最早推出柔印CTP的企业之一,专注于工业化打印技术的研发及应用，掌握了大量CTP核心技术,"3D打印,柔性屏",
300506.SZ,名家汇,34.8,42.6,6.13,0.0,建筑装饰-建筑装饰-装饰园林,城市照明,家居装修,建筑业,照明工程,国内少数同时拥有照明工程承包壹级设计甲级资质的企业,城市照明领域的系统方案解决专家,"智慧灯杆,节能减排,比亚迪,IGBT,智慧城市,芯片,环氧树脂,节能照明,边缘计算",
300497.SZ,富祥药业,58.8,72.3,13.14,0.0,医药生物-化学制药-原料药,原料药,生物,生物医药,舒巴坦、他唑巴坦,业内舒巴坦、他唑巴坦的主要供应商之一,β-内酰胺类酶抑制剂和碳青霉烯类产品的重要供应商,"肝炎,新冠治疗,抗艾滋病,有机硅,猴痘,人民币贬值受益,CRO,生物医药,辉瑞,瑞德西韦,锂电池","创业300,中证1000"
300496.SZ,中科创达,368.8,462.6,101.12,0.0,计算机-计算机应用-IT服务,基础软件,计算机,科技,应用软件开发,全球领先的智能操作系统产品和技术提供商,全球领先的智能操作系统产品和技术提供商,"物联网,智能汽车,区块链,MSCI,MLOps,国产操作系统,车联网,物联网感知层,元宇宙,机器视觉,增强现实,图像识别,寒武纪,华为欧拉,智能穿戴,英伟达,智能电视,独角兽,台湾,华为,机器人,边缘计算,鸿蒙,无人驾驶,滴滴,虚拟数字人,虚拟现实,混合现实,华为海思,ChatGPT,5G,人工智能","创业板50,沪深300,创业300"
300492.SZ,华图山鼎,83.9,83.9,59.7,0.0,建筑装饰-建筑装饰-工程咨询服务,工程设计,工程设计,建筑业,建筑工程设计,拥有较为全面的建筑设计能力及客户服务能力,拥有较为全面的建筑设计能力及客户服务能力,"跨境电商,节能环保,精装修",
300355.SZ,蒙草生态,46.4,55.5,3.46,0.0,环保-环保-综合环境治理,综合环保,环保,公共事业,绿化工程,国内草原生态修复的龙头企业,核心业务涉及：生态修复、节水园林、现代草业、草种业、生态牧场,"太空经济,足球,GEP,美丽中国,土壤修复,村镇银行,抗旱,风沙治理,长江防护林,PPP,大数据,园林开发,碳中和,优先股",
300348.SZ,长亮科技,62.4,74.0,10.12,0.0,计算机-计算机应用-软件开发,金融科技,计算机,科技,金融软件,国内领先的金融核心系统解决方案供应商,国内领先的金融核心系统解决方案供应商,"跨境支付（CIPS）,互联网银行,腾讯,华为,信创,金融信息服务,阿里巴巴,国产软件,大数据,金融科技,互联网金融,华为鲲鹏,智慧城市,数字货币,人工智能","创业300,中证1000"
300267.SZ,尔康制药,45.3,65.8,3.19,0.0,医药生物-化学制药-原料药,原料药,生物,生物医药,淀粉及淀粉囊系列,国内品种齐全的药用辅料龙头企业,是国内品种最全、规模最大的专业药用辅料生产企业之一,"锂电原料,中医药,超级真菌,幽门螺杆菌,维生素,消毒剂,医药电商,NMN","创业300,中证1000"
300254.SZ,仟源医药,16.9,18.2,7.52,0.0,医药生物-化学制药-化学制剂,制药,生物,生物医药,化学制剂,全国青霉素市场和半合成青霉素复方制剂市场前列,全国青霉素市场和半合成青霉素复方制剂市场前列,"肝炎,中医药,基因测序,养老,生物医药,新冠检测,仿制药一致性评价,医保目录,创新药,新冠治疗,蒙脱石散,维生素,医疗器械,新冠特效药,三胎,体外诊断",
300210.SZ,森远股份,15.1,15.2,3.13,0.0,机械设备-专用设备-其他专用设备,工程机械,工程机械,建筑业,公路养护设备,国内领先的提供沥青路面就地再生技术解决方案的企业,新型公路养护机械的技术开发和制造的企业,"PPP,地下管网,除雪,新能源汽车,沥青,3D打印,公路建设,雄安新区",
300194.SZ,福安药业,37.7,46.4,3.9,0.0,医药生物-化学制药-化学制剂,抗生素,生物,生物医药,化学制剂,原料药及制剂生产商,主要从事抗生素原料药及制剂的研发和生产,"肝炎,抗艾滋病,生物医药,工业大麻,仿制药一致性评价,医保目录,抗肿瘤,幽门螺杆菌,猴痘,抗癌,仿制药",
300169.SZ,天晟新材,12.9,14.0,4.28,0.0,基础化工-化学制品-其他化学制品,化学制品,基础化工,化工,结构发泡材料,全国知名的高分子发泡材料专业生产商,专业的高分子发泡材料生产商,"智能穿戴,新材料,快手,露营经济,高端装备,土壤修复,医疗器械,噪声防治,污水处理,华为,建筑节能,小米",
300146.SZ,汤臣倍健,236.0,355.2,20.89,0.0,食品饮料-食品加工制造-其他食品,保健品,食品,必需消费,功能性膳食补充剂,中国保健行业第一家AAA信用等级企业,中国膳食营养补充剂领导品牌和标杆企业，3A信用等级企业,"MSCI,智能医疗,基因测序,迪士尼,维生素,粤港澳大湾区,保健品,医药电商","创业300,中证500"
300137.SZ,先河环保,26.1,30.3,5.55,0.0,环保-环保-环保设备,环保设备,环保,公共事业,监测设备,在大气监测领域占据市场主导地位,中国环境监测仪器仪表行业知名品牌,"区块链应用,环境监测,碳交易,区块链,碳中和,冬奥会,农村环境治理,污水处理,水利,废气处理,乡村振兴,节能环保,PM2.5,雄安新区",
300111.SZ,向日葵,34.2,39.3,3.05,0.0,医药生物-化学制药-化学制剂,制药,生物,生物医药,抗感染药物,已拥有较为完整的抗感染、抗高血压药物产业链,国内少数具有自主技术并能规模生产太阳能电池片及组件的光伏企业,"高血压药,TOPCON电池,分布式发电,生物医药",
300099.SZ,精准信息,36.2,46.0,6.24,0.0,机械设备-专用设备-能源及重型设备,煤矿设备,机械设备,机械,矿山智能化监控监测,国内煤矿顶板灾害防治设备龙头企业,国内煤矿顶板灾害防治设备龙头企业,"军工,区块链,空铁WIFI,氢能源,特高压,军民融合,新能源汽车,华为,芯片,5G,燃料电池",
300086.SZ,康芝药业,26.6,27.5,6.11,0.0,医药生物-化学制药-化学制剂,制药,生物,生物医药,儿童药、成人药,中国儿童药领域家喻户晓的知名品牌,国内领先的儿童大健康企业，主营儿童药、婴童健康用品，拥有儿童药品种30多个,"肝炎,中医药,儿童医药医疗,三胎,超级真菌,消毒剂,流感,生物医药,板蓝根,仿制药一致性评价,辅助生殖,新冠治疗,幽门螺杆菌,蒙脱石散,两会,海南自贸区,口罩,三沙",
300085.SZ,银之杰,59.0,79.1,11.2,0.0,计算机-计算机应用-软件开发,金融科技,计算机,科技,电信服务,金融科技服务提供商之一,金融科技服务公司,"MSCI,区块链,碳中和,富媒体,华为,信创,国产软件,大数据,互联网保险,金融科技,电子商务,互联网金融,百度,华为鲲鹏,征信,跨境电商,数字货币,云计算,人工智能","创业300,中证1000"
300072.SZ,海新能科,81.5,82.2,3.5,0.0,基础化工-化学制品-其他化学制品,化学制品,基础化工,化工,能源净化,国内能源净化行业龙头企业,国内能源净化行业龙头企业,"MSCI,北京国企改革,化肥,国企改革,尾气治理,乡村振兴,PM2.5,PPP,油品升级,生态农业,页岩气,废气处理,节能环保,地方国企改革,脱硫脱硝",创业300
300071.SZ,福石控股,35.3,36.6,3.86,0.0,传媒-传媒-广告营销,广告营销,传媒,科技,整合营销,国内大型整合营销服务集团，线下营销服务供应商,国内大型整合营销服务集团，线下营销服务供应商,"抖音,元宇宙,web3.0,数字经济,京津冀一体化,比亚迪,ChatGPT,文化传媒,广告营销,华为",
300067.SZ,安诺其,22.4,30.5,2.9,0.0,基础化工-化学制品-纺织化学用品,纺织原料,纺织,可选消费,染料,专注于新型纺织面料和个性化需求面料的染料产品,国内高端染料行业领跑者,"PPP,军工,新材料,海工装备,区块链,柔性屏,电子纸,长三角一体化,电子商务,染料,污水处理,独角兽,芯片,节能环保,C2M",
300026.SZ,红日药业,137.9,153.2,5.1,0.0,医药生物-中药-中药Ⅲ,中药,中药,生物医药,中药配方颗粒,“全成分”中药配方颗粒行业内唯一的全成分产品品牌,血必净注射液等产品垄断细分市场,"中医药,互联网医疗,国企改革,流感,登革热,肝素,仿制药一致性评价,医保目录,血氧仪,创新药,新冠治疗,四川国企改革,医疗器械,地方国企改革","创业300,中证500"
300022.SZ,吉峰科技,16.5,25.2,5.09,0.0,商贸零售-零售-专业连锁,连锁,零售,可选消费,农业机械,国内农机连锁销售龙头企业,国内农机连锁销售龙头企业,"农村电商,三农,电子商务,农机,成渝特区,乡村振兴,工业大麻",
300016.SZ,北陆药业,32.5,32.6,6.62,0.0,医药生物-化学制药-化学制剂,制药,生物,生物医药,对比剂系列,对比剂领域品牌影响力和市场份额不断提升,国内医药对比剂行业领跑者,"医保目录,中医药,创新药,抗肿瘤,基因测序,专精特新,独角兽,生物医药,仿制药一致性评价",
003035.SZ,南网能源,114.4,264.8,6.99,0.0,公用事业-电力-电能综合服务,供电,电力,公共事业,节能服务,全国领先的工业节能、建筑节能、城市照明节能服务商,全国领先的工业节能、建筑节能、城市照明节能投资运营服务商,"智能电网,新能源,国企改革,绿色电力,光伏,碳中和,节能环保,风电,建筑节能,央企国企改革,地方国企改革",中证500
003001.SZ,中岩大地,8.0,20.7,16.25,0.0,建筑装饰-建筑装饰-专业工程,建筑工程,基建,建筑业,岩土工程,全国注册岩土工程师继续教育必修教材的主编单位,全国注册土木工程师（岩土）继续教育必修教材的主编单位,"智慧停车,人工智能,土壤修复,基建工程,职业教育,在线教育,一带一路,装配式建筑,雄安新区",
002966.SZ,苏州银行,236.6,244.9,6.68,0.0,银行-银行-城商行,城商行,银行,金融,城商行,由东吴农村商业银行深化改制而成的股份制商业银行,苏州本土唯一具备法人资格的城商行,"村镇银行,MSCI",中证500
002958.SZ,青农商行,133.1,151.1,2.72,0.0,银行-银行-农商行,农商行,银行,金融,农商行,山东省第一家地市级农村商业银行,山东省第一家地级市农商行,MSCI,中证500
002926.SZ,华西证券,220.0,220.0,8.38,0.0,非银金融-证券-证券Ⅲ,证券,非银金融,金融,A级券商,综合实力在西部地区证券公司中居于领先地位,公司综合实力在西部地区证券公司中居于领先地位,"MSCI,国企改革,期货,地方国企改革",中证500
002918.SZ,蒙娜丽莎,32.5,61.4,14.8,0.0,轻工制造-家用轻工-瓷砖地板,地板,家居装修,建筑业,高品质建筑陶瓷,国内瓷砖行业知名品牌,从事高品质建筑陶瓷产品的研发、生产和销售,"精装修,杭州亚运会,陶瓷产品,数据中心",中证1000
002865.SZ,钧达股份,254.7,297.5,131.29,0.0,电力设备-电力设备-光伏设备,电池片,光伏,电力设备,光伏电池片,全球领先的太阳能电池解决方案提供商,控股子公司捷泰科技主打的单晶太阳能电池达到国际领先水平,"养老金持股,新能源汽车,光伏,小鹏汽车,TOPCON电池,海南自贸区",中证1000
002817.SZ,黄山胶囊,25.3,26.1,8.73,0.0,医药生物-医疗器械-医疗耗材,医疗耗材,医疗器械,生物医药,明胶空心胶囊,技术领先质量可靠的药用胶囊龙头企业,工信部专精特新“小巨人”企业，拥有三十多年高品质药用空心胶囊生产历史,"专精特新,医疗器械",
002807.SZ,江阴银行,80.3,80.4,3.7,0.0,银行-银行-农商行,农商行,银行,金融,农商行,全国首批三家股份制农村商业银行之一,践行支农支小普惠金融的农商行,,中证1000
002721.SZ,*ST金一,34.0,34.0,3.54,0.0,轻工制造-家用轻工-饰品,珠宝,贵金属,金融,珠宝首饰,推动中国黄金珠宝行业发展和产业升级的领先企业,北京海淀区国资委旗下黄金珠宝饰品企业，收购卡尼小贷布局供应链金融,"黄金,杭州亚运会,北京国企改革,冬奥会,国企改革,冬奥纪念品,黄金租赁,3D打印,小金属,抖音小店,地方国企改革",
002673.SZ,西部证券,265.5,288.7,6.46,0.0,非银金融-证券-证券Ⅲ,证券,非银金融,金融,A级券商,陕西省唯一一家全牌照的上市证券公司,深耕西部地区，在陕西省内具有领先的市场地位,"MSCI,国企改革,期货,地方国企改革",中证500
002661.SZ,克明食品,36.1,36.8,11.06,0.0,食品饮料-食品加工制造-其他食品,粮食加工,农业,必需消费,如意面,挂面行业唯一上市公司,中国最大的挂面制造企业之一,"猪肉,大消费,面粉,小额贷款",
002652.SZ,扬子新材,13.9,13.9,2.71,0.0,建筑材料-建筑材料-其他建材,光缆,通信,科技,有机涂层板,国内有机涂层板行业具有较强研发能力和竞争力的厂商,专网通信、光纤、光缆、射频电缆、通信硅管产品成本行业领先水平,"新材料,雄安新区",
002638.SZ,勤上股份,45.3,48.6,3.36,0.0,电子-光学光电子-LED,教育,社会服务,可选消费,LED照明、教育培训,半导体照明产品与教育的双主业布局企业,实现半导体照明产品与教育的双主业布局,"智慧灯杆,智能终端,智慧城市,杭州亚运会,职业教育,节能照明",
002622.SZ,皓宸医疗,26.5,26.5,3.15,0.0,医药生物-医疗服务-其他医疗服务,医疗诊断,医疗服务,生物医药,永磁开关,永磁开关细分行业的较领先地位,永磁开关及高低压开关成套设备研发、生产和销售，中国驰名商标,"健康中国,民营医院,智能电网,大数据,国产软件,牙科医疗",
002620.SZ,瑞和股份,16.8,20.2,5.35,0.0,建筑装饰-建筑装饰-装饰园林,建筑装饰,家居装修,建筑业,公共装饰工程,我国公共建筑装饰行业龙头企业之一,国家建筑装饰和幕墙施工一级、设计甲级企业,"精装修,光伏建筑一体化,全屋定制,光伏,新型城镇化,建筑节能,恒大,装配式建筑",
002602.SZ,世纪华通,481.5,521.7,7.0,0.0,传媒-传媒-游戏,游戏,传媒,科技,游戏、汽车零部件,网络游戏和汽车用塑料零部件双主业的企业,网络游戏和汽车用塑料零部件双主业的企业,"特斯拉,IP,MSCI,长三角一体化,中概股回归,网络游戏,云游戏,东数西算（算力）,数据中心,腾讯,元宇宙,华为,手机游戏,VR游戏,数据安全,算力租赁,虚拟数字人,虚拟现实,比亚迪,脑机接口,NFT,新能源汽车,电子竞技,共同富裕示范区,云计算",
002554.SZ,惠博普,32.5,50.4,3.74,0.0,石油石化-油气开采及服务-油服工程,油服工程,石油,资源,油气田装备,国内油气田地面系统装备领域的知名企业,国内油气田地面系统装备领域的知名企业,"天然气,碳交易,地下管网,国企改革,油气开采,俄乌冲突,垃圾分类,湖南国企改革,油气装备,氢能源,一带一路,人民币贬值受益,光伏,油页岩,碳中和,节能环保,地方国企改革",
002542.SZ,中化岩土,43.4,49.3,2.73,0.0,建筑装饰-建筑装饰-专业工程,建筑工程,基建,建筑业,勘察设计咨询,国内领先的岩土工程和地下空间工程服务提供商,在强夯地基处理细分市场中具有国内领先地位,"云计算,地下管网,国企改革,影视娱乐,煤化工,特色小镇,芯片,通用航空,数据中心,旅游,文化传媒,PPP,四川国企改革,互联网金融,一带一路,新型城镇化,地方国企改革,雄安新区",
002540.SZ,亚太科技,51.4,73.4,5.87,0.0,有色金属-工业金属-铝,铝,有色金属,资源,挤压型材,国内汽车热交换系统零部件原材料的主要供应商,全球汽车行业铝材重要供应商,"军工,铝材加工,海水淡化,大飞机,比亚迪,稀土永磁,理想汽车,新能源汽车,蔚来汽车,汽车热管理,3D打印,有色铝",
002526.SZ,山东矿机,43.3,43.9,2.46,0.0,机械设备-专用设备-能源及重型设备,煤矿设备,机械设备,机械,煤机,全国前十大煤炭机械制造企业之一,全国前十大煤炭机械制造企业之列,"工业机器人,手机游戏,工业4.0,高端装备,网络游戏,无人机,减速器,3D打印,机器人",
002516.SZ,旷达科技,46.3,71.5,4.86,0.0,交运设备-汽车零部件-汽车零部件Ⅲ,内饰,汽车零部件,汽车,汽车内饰件,中国汽车零部件内饰件行业龙头企业,布局打造国内最优质的SAW滤波器公司，国内汽车内饰面料行业龙头企业,"太阳能,新能源,国产替代,射频器,光伏,抗病毒面料,芯片,5G,合成革,绿色电力,汽车芯片,汽车电子",中证1000
002511.SZ,中顺洁柔,137.9,142.0,10.64,0.0,美容护理-美容护理-个护用品,护理品,医美,可选消费,生活纸,生活用纸龙头企业,国内生活用纸行业第一梯队成员,"MSCI,造纸转暖,口罩,纸浆",中证500
002500.SZ,山西证券,203.5,203.5,5.67,0.0,非银金融-证券-证券Ⅲ,证券,非银金融,金融,A级券商,山西省内唯一一家综合类证券公司,FICC、期货业务成为公司的重要支撑,"MSCI,证金持股,国企改革,山西国企改革,地方国企改革",中证500
002474.SZ,榕基软件,36.1,44.5,7.16,0.0,计算机-计算机应用-IT服务,电子政务,计算机,科技,电子政务,国内电子政务和协同管理细分领域的领先服务厂商,电子政务、质检三电工程、协同管理、信息安全等软件提供商，华为优选级ISV伙伴，与华为在多领域有合作,"物联网,核污染防治,数字中国,区块链,web3.0,云办公,京东,安防,智慧党建,电子信息,电力物联网,疫情监测,华为,信创,国产软件,智能电网,现代服务业,物联网平台层,数字经济,虚拟现实,在线教育,VR平台,华为鲲鹏,VPN,智慧城市,智慧政务,网络安全,人工智能",
002456.SZ,欧菲光,190.8,191.9,5.89,0.0,电子-光学光电子-光学元件,光学电子,消费电子,科技,光学、电子器件,触控显示模组、摄像头模组、指纹识别模组龙头,光学光电行业龙头，市占率中国第一，指纹识别模组出货量稳居全球前列,"屏下指纹技术,智能终端,智能汽车,柔性屏,虹膜识别,MSCI,传感器,消费电子,WIN升级,台湾,车联网,元宇宙,OLED,华为,小米,机器人,汽车电子,增强现实,无人驾驶,雷达,虚拟现实,智慧城市,人脸识别,TOF镜头,毫米波雷达",中证1000
002425.SZ,凯撒文化,50.5,50.5,5.28,0.0,传媒-传媒-游戏,游戏,传媒,科技,移动端网络游戏,从事动漫、游戏、影视的互联网泛娱乐运营商,以精品IP为核心，从事手游、影视剧、动漫业务的泛娱乐公司,"IP,网络游戏,云游戏,腾讯,快手,元宇宙,华为,文化传媒,阿里巴巴,手机游戏,抖音,虚拟现实,NFT,动漫,AIGC,人工智能",
002408.SZ,齐翔腾达,174.7,179.7,6.32,0.0,石油石化-石油加工贸易-石油加工,石油化工,石油,资源,顺酐类,国内C4深加工产业链龙头,国内规模最大的甲乙酮生产企业,"MTBE,甲乙酮,油品升级,可降解塑料,橡胶,环氧丙烷,氢能源,国企改革,丙烯,山东国企改革,地方国企改革",中证500
002374.SZ,中锐股份,41.4,42.2,3.88,0.0,轻工制造-包装印刷-包装,包装,包装印刷,可选消费,防伪瓶盖,铝板复合型防伪印刷和防伪瓶盖专业厂家,铝板复合型防伪印刷和防伪瓶盖等关联多元化的一条龙服务的专业厂家,"PPP,白酒,区块链,美丽中国,海绵城市,污水处理,园林开发",
002358.SZ,森源电气,45.0,45.1,4.85,0.0,电力设备-电力设备-输变电设备,输变电,电气设备,电力设备,高低压成套开关,高低压成套开关设备行业的领军企业,国内一流的高中压开关设备和电力电子装置的中试、研发平台,"核电,国企改革,垃圾分类,高压快充,机器人,智慧灯杆,智能电网,柔性直流输电,充电桩,河南国企改革,特高压,轨道交通,光伏,风电,地方国企改革",
002349.SZ,精华制药,72.4,72.6,8.92,0.0,医药生物-中药-中药Ⅲ,中药,中药,生物医药,中药制剂,南通国资委旗下药企，独家王氏保赤丸、季德胜蛇药片,南通国资委旗下药企，拥有独家品种王氏保赤丸、季德胜蛇药片,"肝炎,中医药,单抗,流感,国企改革,养老,生物医药,医保目录,抗肿瘤,新冠治疗,透明工厂,新冠特效药,医药电商,地方国企改革,锂电池",中证1000
002332.SZ,仙琚制药,125.9,127.6,12.9,0.0,医药生物-化学制药-化学制剂,制药,生物,生物医药,皮质激素,国内规模最大、品种最为齐全的甾体药物生产厂家,国内规模最大、品种最为齐全的甾体药物生产厂家,"辅助生殖,毛发医疗,创新药,国企改革,生物医药,地方国企改革",中证1000
002325.SZ,洪涛股份,21.2,26.0,1.48,0.0,建筑装饰-建筑装饰-装饰园林,建筑装饰,家居装修,建筑业,公共装饰工程,高端建筑装饰行业的持续领跑者，设计能力行业领先,高端建筑装饰行业的持续领跑者,"在线教育,氢能源,粤港澳大湾区,电子商务,一元股,智慧城市,数据中心",
002319.SZ,乐通股份,32.6,32.6,16.3,0.0,基础化工-化学制品-涂料油墨,印刷,包装印刷,可选消费,凹印油墨,国内包装印刷油墨行业的龙头企业,珠海市包装印刷油墨行业领先企业,"石墨烯油墨,广告营销,石墨烯,柔性屏,文化传媒,横琴新区",
002310.SZ,东方园林,45.3,46.7,1.74,0.0,环保-环保-综合环境治理,园林景观,家居装修,建筑业,园林建设,综合生态集团，危废处理技术国内领先,水环境治理、市政园林、全域旅游三大领域的领先企业,"核污染防治,动力电池回收,美丽中国,土壤修复,北京国企改革,医疗废物处理,国企改革,污水处理,铜冶炼,乡村振兴,海绵城市,一元股,矿山生态修复,新型城镇化,地方国企改革,京东,水利,旅游,危废处理,汽车拆解,PPP,生态城乡,固废处理,油品改革,园林开发,节能环保,雄安新区",中证1000
002278.SZ,神开股份,18.6,19.9,5.48,0.0,机械设备-专用设备-能源及重型设备,油气设备,机械设备,机械,钻采设备,国内石油化工装备制造业的骨干企业之一,我国石油化工装备制造业的骨干企业之一,"中俄贸易,可燃冰,海洋经济,一带一路,页岩气,俄乌冲突,专精特新",
002269.SZ,美邦服饰,39.9,39.9,1.59,0.0,纺织服装-服装家纺-服装,服装,纺织,可选消费,休闲装,国内休闲服饰领导品牌之一,休闲服生产销售企业，拥有五个知名的男装及女装品牌,"中俄贸易,抗寒,新零售,迪士尼,电子商务,一元股,三胎",
002249.SZ,大洋电机,99.6,133.9,5.62,0.0,电力设备-电力设备-电机,电机,电气设备,电力设备,电机,电机及驱动系统技术处于国际领先水平,已形成了“电机+电控+氢燃料电池”的完整产业链,"军工,新能源整车,稀土永磁,芯片,燃料电池,扁线电机,芯片封装测试,充电桩,小鹏汽车,比亚迪,电机电控,氢能源,IGBT,北汽新能源,节能电机,新能源汽车,海上风电,恒大",中证500
002243.SZ,力合科创,105.0,105.0,8.67,0.0,社会服务-其他社会服务-专业服务,包装,包装印刷,可选消费,科创服务、新材料,国内知名的科创服务企业,深圳国资委旗下，形成“科创服务+新材料”业务模式，拥有富勒烯碳纳米材料工程实验室,"深圳国企改革,物业管理,石墨烯,迪士尼,国企改革,东数西算（算力）,抗病毒面料,芯片,数据中心,碳基材料,大数据,可降解塑料,广东国企改革,数字经济,食品包装,冷链物流,富勒烯,智慧城市,铝离子电池,地方国企改革,锂电池",中证1000
002226.SZ,江南化工,91.6,136.2,5.14,0.0,基础化工-化学制品-民爆用品,民爆,建筑材料,建筑业,民用炸药,乳化炸药产销量居全国第一位,深耕民爆业务，扎实推进风电、光伏等新能源业务,"太阳能,国企改革,独角兽,绿色电力,新能源,服务机器人,中兵系,专精特新,一带一路,新能源汽车,光伏,央企国企改革,民爆,风电,地方国企改革,人工智能",中证1000
002210.SZ,飞马国际,49.0,49.0,1.84,0.0,环保-环保-固废治理,垃圾处理,环保,公共事业,垃圾焚烧发电,公司转型为环保新能源行业，主营垃圾焚烧发电,深圳市重点物流企业,"固废处理,统一大市场,生物质能发电,上海自贸区,电子商务,一元股,粤港澳大湾区,节能环保",
